{"executed":{"func.call":3,"func.return":11,"stablehlo.add":11,"stablehlo.compare":3,"stablehlo.composite":7,"stablehlo.concatenate":13,"stablehlo.constant":18,"stablehlo.convert":4,"stablehlo.custom_call":3,"stablehlo.divide":2,"stablehlo.dot_general":7,"stablehlo.dynamic_broadcast_in_dim":13,"stablehlo.get_dimension_size":2,"stablehlo.maximum":2,"stablehlo.reduce":2,"stablehlo.reshape":31,"stablehlo.return":2},"model":"toy","ops":[{"flops":null,"kind":"dot_general","lhs_shape":[null,null,4],"op":"stablehlo.dot_general","out_shape":[null,null,16],"rhs_shape":[4,16],"sig":"f32xf32->f32"},{"flops":null,"kind":"dot_general","lhs_shape":[null,null,16],"op":"stablehlo.dot_general","out_shape":[null,null,16],"rhs_shape":[16,16],"sig":"f32xf32->f32"},{"flops":null,"kind":"dot_general","lhs_shape":[null,null,16],"op":"stablehlo.dot_general","out_shape":[null,null,null],"rhs_shape":[null,null,16],"sig":"f32xf32->f32"},{"flops":null,"kind":"dot_general","lhs_shape":[null,null,16],"op":"stablehlo.dot_general","out_shape":[null,null,16],"rhs_shape":[16,16],"sig":"f32xf32->f32"},{"flops":null,"kind":"dot_general","lhs_shape":[null,null,16],"op":"stablehlo.dot_general","out_shape":[null,null,16],"rhs_shape":[16,16],"sig":"f32xf32->f32"},{"flops":null,"kind":"dot_general","lhs_shape":[null,null,16],"op":"stablehlo.dot_general","out_shape":[null,null,null],"rhs_shape":[null,null,16],"sig":"f32xf32->f32"},{"flops":null,"kind":"dot_general","lhs_shape":[null,null,16],"op":"stablehlo.dot_general","out_shape":[null,null,16],"rhs_shape":[16,16],"sig":"f32xf32->f32"}],"phase":"forward_b1","schema":"cc.export.census/1","summary":{"dot_general f32xf32->f32":{"count":7,"flops":null}}}
